Key,Item Type,Publication Year,Author,Title,Publication Title,ISBN,ISSN,DOI,Url,Abstract Note,Date,Date Added,Date Modified,Access Date,Pages,Num Pages,Issue,Volume,Number Of Volumes,Journal Abbreviation,Short Title,Series,Series Number,Series Text,Series Title,Publisher,Place,Language,Rights,Type,Archive,Archive Location,Library Catalog,Call Number,Extra,Notes,File Attachments,Link Attachments,Manual Tags,Automatic Tags,Editor,Series Editor,Translator,Contributor,Attorney Agent,Book Author,Cast Member,Commenter,Composer,Cosponsor,Counsel,Interviewer,Producer,Recipient,Reviewed Author,Scriptwriter,Words By,Guest,Number,Edition,Running Time,Scale,Medium,Artwork Size,Filing Date,Application Number,Assignee,Issuing Authority,Country,Meeting Name,Conference Name,Court,References,Reporter,Legal Status,Priority Numbers,Programming Language,Version,System,Code,Code Number,Section,Session,Committee,History,Legislative Body
YJE9H7US,journalArticle,2022,"Panda, Sakshyam; Rass, Stefan; Moschoyiannis, Sotiris; Liang, K.; Loukas, George; Panaousis, Emmanouil",HoneyCar: A framework to configure honeypot vulnerabilities on the internet of vehicles,IEEE Access,,2169-3536,10.1109/ACCESS.2022.3210117,https://ieeexplore.ieee.org/document/9903648/,"The Internet of Vehicles (IoV), whereby interconnected vehicles that communicate with each other and with road infrastructure on a common network, has promising socio-economic benefits but also poses new cyber-physical threats. To protect these entities and learn about adversaries, data on attackers can be realistically gathered using decoy systems like honeypots. Admittedly, honeypots introduces a trade-off between the level of honeypot-attacker interactions and incurred overheads and costs for implementing and monitoring these systems. Deception through honeypots can be achieved by strategically configuring the honeypots to represent components of the IoV to engage attackers and collect cyber threat intelligence. Here, we present HoneyCar, a novel decision support framework for honeypot deception in IoV. HoneyCar benefits from the repository of known vulnerabilities of the autonomous and connected vehicles found in the Common Vulnerabilities and Exposure (CVE) database to compute optimal honeypot configuration strategies. The adversarial interaction is modelled as a repeated imperfect-information zero-sum game where the IoV network administrator strategically chooses a set of vulnerabilities to offer in a honeypot and a strategic attacker chooses a vulnerability to exploit under uncertainty. Our investigation examines two different versions of the game, with and without the re-configuration cost, to empower the network administrator to determine optimal honeypot investment strategies given a budget. We show the feasibility of this approach in a case study that consists of the vulnerabilities in autonomous and connected vehicles gathered from the CVE database and data extracted from the Common Vulnerability Scoring System (CVSS). 【摘要翻译】车辆互联网(IoV)是指互相连接的车辆在一个共同的网络上相互通信，并与道路基础设施进行通信。它具有良好的社会经济效益，但也带来了新的网络物理威胁。为了保护这些实体并了解对手，可以使用诱饵系统(如蜜罐)实际收集攻击者的数据。诚然，蜜罐引入了蜜罐-攻击者交互级别与实现和监视这些系统的开销和成本之间的权衡。通过蜜罐进行欺骗可以通过战略性地配置蜜罐来代表 IOV 的组成部分，从而使攻击者受到攻击并收集网络威胁情报来实现。在这里，我们介绍了 HoneyCar，一个新的用于 IoV 中蜜罐欺骗的决策支持框架。HoneyCar 从公共漏洞和暴露(CVE)数据库中发现的自主和连接车辆的已知漏洞存储库中获益，以计算最佳蜜罐配置策略。这种对抗性的互动被建模为一种重复的不完美信息零和游戏，在这种游戏中，IoV 网络管理员战略性地选择一组漏洞在蜜罐中提供，而战略性的攻击者则选择一个漏洞在不确定性下利用。我们的调查研究了两种不同版本的游戏，有和没有重新配置成本，以授权网络管理员决定最佳蜜罐投资策略给定的预算。通过一个案例研究，我们证明了该方法的可行性，该案例研究包括从 CVE 数据库中收集的自主和连接车辆的脆弱性以及从通用脆弱性评分系统(CVSS)中提取的数据。",2022,2023/12/18 11:00,2023/12/24 11:02,,104671-104685,,,10,,IEEE Access,HoneyCar: 一个在车辆互联网上配置蜜罐漏洞的框架,,,,,,,en,2⭐,,,14 被引,3.9 (Q2),3,🏷️ /Done、📒、博弈论、蜜罐、优化、诱饵系统、notion、📝 创新,"<h2 style=""color: purple;"">📑 翻译倒序>>>>>>></h2><blockquote>🔉 英  [无]<br>🔉 美  [无]<br>n.  英语字母表的第15个字母<p>👉 o</blockquote><blockquote>🔉 英  [无]<br>🔉 美  [无]<br>n.  英语字母表的第8个字母<p>👉 h</blockquote><blockquote>🔉 英  [ˈæbstrækt, æbˈstrækt]<br>🔉 美  [ˈæbstrækt, æbˈstrækt]<br>adj.  抽象的，理论上的,难解的,抽象派的,茫然的<br>n.  抽象概念,抽象派艺术作品,摘要,[化]萃取物<br>vt.  提取，分离,转移（注意等）,概括，摘录,<婉辞>剽窃<p>👉 abstract</blockquote>; <h2 style=""color: #ff4757;"">📝 注释笔记 6D8RB89J>>>>>>></h2><blockquote><span style=""font-size: 15px;color: gray"">📍 2022-Panda-HoneyCar: A framework to configure honeypot vulnerabilities on the internet of vehicles</span></blockquote><blockquote><span class=""highlight"" style=""background-color: #ffd400"">To protect these entities and learn about adversaries, data on attackers can be realistically gathered using decoy systems like honeypots. Admittedly, honeypots introduces a tradeoff between the level of honeypot-attacker interactions and incurred overheads and costs for implementing and monitoring these systems. Deception through honeypots can be achieved by strategically conﬁguring the honeypots to represent components of the IoV to engage attackers and collect cyber threat intelligence.</span><p>【译文】为了保护这些实体并了解对手，可以使用蜜罐等诱饵系统实际收集攻击者的数据。诚然，蜜罐在蜜罐攻击者交互水平与实施和监控这些系统的开销和成本之间引入了权衡。通过蜜罐进行欺骗可以通过战略性地配置蜜罐来代表车联网的组件来吸引攻击者并收集网络威胁情报来实现。【译文】 (<a href=""zotero://open-pdf/library/items/6D8RB89J?page=1&annotation=VTXJJ6DX"">p1</a>)</blockquote><blockquote><span class=""highlight"" style=""background-color: #ff6666"">HoneyCar uses a game-theoretic model to capture the interaction between the Defender and the Attacker using a repeated imperfect-information zero-sum game. This work makes the following contributions: • presents a novel decision support framework called HoneyCar to examine practical (cost-effective) honeypot investment decisions. • presents a novel game-theoretic model demonstrating the strategic use of honeypot through cost-effective selection and conﬁguration (or re-conﬁguration) of honeypot within a budget</span><p>【译文】HoneyCar 使用博弈论模型通过重复的不完美信息零和博弈来捕获防御者和攻击者之间的交互。这项工作做出了以下贡献： • 提出了一种称为 HoneyCar 的新型决策支持框架，用于检查实际（具有成本效益）的蜜罐投资决策。 • 提出一种新颖的博弈论模型，通过在预算范围内经济高效地选择和配置（或重新配置）蜜罐，展示蜜罐的战略使用【译文】 (<a href=""zotero://open-pdf/library/items/6D8RB89J?page=2&annotation=LAIABCSF"">p2</a>)<p>🏷️ #创新</blockquote><blockquote><span class=""highlight"" style=""background-color: #ff6666"">generate the optimal honeypot conﬁguration strategies for the Defender.</span><p>【译文】为防御者生成最佳蜜罐配置策略。【译文】 (<a href=""zotero://open-pdf/library/items/6D8RB89J?page=6&annotation=57ETH9LC"">p6</a>)</blockquote><blockquote><span class=""highlight"" style=""background-color: #ff6666"">HoneyCar is built upon two models: (i) a formal model of assessing the option of the Defender to invest in cyber deception using honeypots; and (ii) a game-theoretic model to strategically determine the conﬁguration and selection of honeypot to be deployed in IoV network.</span><p>【译文】HoneyCar建立在两个模型之上：（i）评估防御者使用蜜罐投资网络欺骗的选项的正式模型；以及（ii）策略性地确定将部署在IoV网络中的蜜罐的配置和选择的博弈论模型。【译文】 (<a href=""zotero://open-pdf/library/items/6D8RB89J?page=13&annotation=WXX4YPKR"">p13</a>)</blockquote>",; E:\研究生\文献\zotero\storage\6D8RB89J\Panda 等 - 2022 - HoneyCar A framework to configure honeypot vulnerabilities on the internet of vehicles.pdf,notion://www.notion.so/HoneyCar-A-framework-to-configure-honeypot-vulnerabilities-on-the-internet-of-vehicles-2164dcdcedc44899ac126ae573178dba,📒; /Done; notion; 博弈论; 优化; 蜜罐; 诱饵系统,,,,,,,,,,,,,,,,,,,,,,,,,,,,,,,,,,,,,,,,,,,,,,,
L5XSALW3,conferencePaper,2021,"Ma, Tianye; Zhang, Rui; Nejad, Mark",Secure connected vehicle-based traffic signal systems against data spoofing attacks,2021 IEEE Wireless Communications and Networking Conference (WCNC),978-1-72819-505-6,,10.1109/WCNC49053.2021.9417524,https://ieeexplore.ieee.org/document/9417524/,"The emerging Connected Vehicle (CV) technology is widely expected to greatly enhance traffic safety and efficiency by enabling vehicles, pedestrians, and infrastructures to communicate with one another. As a promising CV application, CV-based traffic signal control aims to improve the traffic efficiency at intersections by dynamically optimizing traffic signal control plans based on the mobility information submitted by surrounding CVs. Effective CV-based traffic control relies on accurate estimation of the queue length i.e., the number of vehicles waiting at intersections, to determine the optimal traffic signal control plans. Despite significant efforts on accurate queue length estimation, the robustness of queue length estimation has so far received very limited attention. A recent study has demonstrated that it is possible for malicious CVs to significantly manipulate the queue length estimation by reporting false mobility data, which can cause severe traffic congestion. To tackle this challenge, we introduce a robust queue length estimation mechanism that first utilizes the mobility data reported by all the CVs waiting in the queue to calculate multiple preliminary queue length estimates. Then, the robust statistical methods are adopted to derive a resulting estimated queue length whose accuracy is kept at an acceptable level even though there exist multiple malicious CVs in the queue. The simulation results confirm the effectiveness of the proposed mechanism. 【摘要翻译】人们普遍认为，新兴的连通车辆(CV)技术可以使车辆、行人和基础设施之间相互通信，从而大大提高交通安全和效率。基于 CV 的交通信号控制是一种很有前途的交通信号控制方法，其目的是根据周围 CV 提供的机动性信息，动态优化交叉口的交通信号控制方案，从而提高交叉口的交通效率。有效的基于 CV 的交通控制依赖于准确估计排队长度，即在交叉口等待的车辆数，以确定最优的交通信号控制方案。尽管人们在准确估计队列长度方面付出了巨大的努力，但是队列长度估计的稳健性迄今为止受到的关注非常有限。最近的一项研究表明，恶意简历有可能通过报告错误的流动性数据来显著操纵队列长度估计，这可能导致严重的交通堵塞。为了解决这一问题，我们引入了一种鲁棒的队列长度估计机制，该机制首先利用队列中等待的所有简历报告的流动性数据来计算多个初步的队列长度估计。然后，采用稳健统计方法得到队列长度估计值，即使队列中存在多个恶意简历，估计值的准确性也保持在可接受的水平。仿真结果证实了该机构的有效性。",2021/3/29,2023/12/18 11:00,2023/12/24 10:19,,,,,,,,基于车辆连接的安全交通信号系统抵御数据欺骗攻击,IEEE wireless communications and networking conference,,,,IEEE / IEEE,"345 E 47TH ST, NEW YORK, NY 10017 USA",en,1⭐,,,,,,🏷️ /Done、📒、数据欺骗攻击、网联汽车、notion、📝 创新,"<h2 style=""color: #ff4757;"">📝 注释笔记 6YPM2CY7>>>>>>></h2><blockquote><span style=""font-size: 15px;color: gray"">📍 2021-Ma-Secure connected vehicle-based traffic signal systems against data spoofing attacks</span></blockquote><blockquote><span class=""highlight"" style=""background-color: #ffd400"">A recent study has demonstrated that it is possible for malicious CVs to signiﬁcantly manipulate the queue length estimation by reporting false mobility data, which can cause severe trafﬁc congestion.</span><p>【译文】最近的一项研究表明，恶意CVs有可能通过报告虚假的移动性数据来显著操纵队列长度估计，这可能导致严重的流量拥塞。【译文】 (<a href=""zotero://open-pdf/library/items/6YPM2CY7?page=1&annotation=KSTE8DJ3"">p1</a>)</blockquote><blockquote><span class=""highlight"" style=""background-color: #ff6666"">We introduce a novel robust queue length estimation mechanism against data spooﬁng attacks for CV-based trafﬁc signal control systems.</span><p>【译文】针对基于CV的交通信号控制系统，提出了一种新的抗数据欺骗攻击的鲁棒队列长度估计机制。【译文】 (<a href=""zotero://open-pdf/library/items/6YPM2CY7?page=2&annotation=LXCA5D4Q"">p2</a>)<p>🏷️ #创新</blockquote>; IEEE Wireless Communications and Networking Conference (WCNC), Nanjing, PEOPLES R CHINA, MAR 29-APR 01, 2021; IEEE Wireless Communications and Networking Conference (WCNC), Nanjing, PEOPLES R CHINA, MAR 29-APR 01, 2021",E:\研究生\文献\zotero\storage\6YPM2CY7\Ma 等 - 2021 - Secure connected vehicle-based traffic signal systems against data spoofing attacks.pdf; ,notion://www.notion.so/Secure-connected-vehicle-based-traffic-signal-systems-against-data-spoofing-attacks-4bb10fa15a91418b8a4e09e245bc3102,📒; /Done; notion; 网联汽车; 数据欺骗攻击,,,,,,,,,,,,,,,,,,,,,,,,,,,,,,,,,,,,,,,,,,,,,,,
LLVPZGZY,conferencePaper,2022,"Zhang, Yanghui; Gao, Kai; Huang, Shuo; Li, Xunhao; Du, Ronghua",Forgery trajectory injection attack detection for traffic lights under connected vehicle environment,"2022 IEEE International Conference on Trust, Security and Privacy in Computing and Communications (TrustCom)",978-1-66549-425-0,,10.1109/TrustCom56396.2022.00188,https://ieeexplore.ieee.org/document/10063728/,"With the connected vehicle (CV) can interact with the infrastructure and can be used as a moving sensor to bring more real-time and higher precision input for intersection signal control. However, such connectivity also brings network security risks.To protect the signal security of intersections, this paper designs a realistic signal attack model based on forged trajectory injection to simulate the potential attack that a smart attacker may launch, the key track points of queued vehicles were extracted, the traffic wave velocity of queued vehicles was used as the distance index to transform forged track recognition into an outlier detection problem, and a forged track detection algorithm based on hierarchical clustering was proposed. Experimental results show that under different attack targets and permeability, the highest detection rate is 95%, and the lowest is 67%. This method does not require training, learning and high computation power of edge equipment. Therefore, it has a certain potential for intersection signal timing using CV trajectory. 【摘要翻译】连通车辆(CV)可以与基础设施相互作用，可以作为运动传感器，为交叉口信号控制带来更多的实时性和更高的输入精度。为了保护交叉口的信号安全，设计了一种基于伪造轨迹注入的真实信号攻击模型，模拟智能攻击者可能发动的攻击，提取排队车辆的关键轨迹点，以排队车辆的交通波速作为距离指标，将伪造轨迹识别转化为一个异常检测问题，提出了一种基于层次聚类的伪造轨迹检测算法。实验结果表明，在不同的攻击目标和渗透率下，最高检测率可达95% ，最低检测率可达67% 。该方法不需要边缘设备的训练、学习和高计算能力。因此，利用 CV 轨迹进行交叉口信号配时具有一定的潜力。",Dec-22,2023/12/18 11:00,2023/12/24 5:19,,1333-1339,,,,,,连通车辆环境下交通灯伪轨迹注入攻击检测,IEEE international conference on trust security and privacy in computing and communications,,,,"IEEE COMPUTER SOC / IEEE; IEEE Comp Soc; Huazhong Univ Sci & Technol; IEEE TCSC; Huazhong Univ Sci & Technol, Sch Cyber Sci & Engn; Huazhong Univ Sci & Technol, CTSC; Hubei Soc Cyberspace Secur Res","10662 LOS VAQUEROS CIRCLE, PO BOX 3014, LOS ALAMITOS, CA 90720-1264 USA",en,2⭐,,,,,,🏷️ /Done、📒、车联网、伪造轨迹、信号攻击、📝 创新,"<h2 style=""color: #ff4757;"">📝 注释笔记 LSXY6UMD>>>>>>></h2><blockquote><span style=""font-size: 15px;color: gray"">📍 2022-Zhang-Forgery trajectory injection attack detection for traffic lights under connected vehicle environment</span></blockquote><blockquote><span class=""highlight"" style=""background-color: #ffd400"">With the connected vehicle (CV) can interact withthe infrastructure and can be used as a moving sensor to bring more real-time and higher precision input for intersection signal control. However, such connectivity also brings network security risks.To protect the signal security of intersections,</span><p>【译文】联网车辆（CV）可以与基础设施交互，并可以用作移动传感器，为交叉口信号控制带来更实时、更高精度的输入。但这种互联也带来了网络安全风险。为保障路口信号安全，【译文】 (<a href=""zotero://open-pdf/library/items/LSXY6UMD?page=1&annotation=6GTYUYFS"">p1</a>)</blockquote><blockquote><span class=""highlight"" style=""background-color: #ff6666"">To establish a kind of signal attack model, this model has a strong operational, only need to control a car snatched the trajectory of interference signal perception model based on trajectory. • Using trafﬁc wave rally wave velocity as a similarity measure, stop using the key points as input, will be abnormal trajectory identiﬁcation problem into outliers detection problem, high detection efﬁciency. • According to the judgment of the stratiﬁcation results of outliers, to ensure the normal points (normal trajectory) will not be testing error detection.</span><p>【译文】建立一种信号攻击模型，该模型具有很强的可操作性，只需要根据轨迹感知模型的干扰信号来控制一辆车抢夺的轨迹。 • 采用交通波反弹波速度作为相似性度量，不再使用关键点作为输入，将异常轨迹识别问题转化为异常点检测问题，检测效率高。 • 根据异常点的分层结果判断，保证正常点（正常轨迹）不会被检测误检。【译文】 (<a href=""zotero://open-pdf/library/items/LSXY6UMD?page=2&annotation=DVQDIUDX"">p2</a>)<p>🏷️ #创新</blockquote>; 21st IEEE International Conference on Trust, Security and Privacy in Computing and Communications (IEEE TrustCom), Wuhan, PEOPLES R CHINA, DEC 09-11, 2022; 21st IEEE International Conference on Trust, Security and Privacy in Computing and Communications (IEEE TrustCom), Wuhan, PEOPLES R CHINA, DEC 09-11, 2022",; E:\研究生\文献\zotero\storage\LSXY6UMD\Zhang 等 - 2022 - Forgery Trajectory Injection Attack Detection for Traffic Lights under Connected Vehicle Environment.pdf,notion://www.notion.so/Forgery-trajectory-injection-attack-detection-for-traffic-lights-under-connected-vehicle-environment-04a5e533a5dd4bbca906ad4f29c2b7fe,📒; /Done; notion; 车联网; 伪造轨迹; 信号攻击,,,,,,,,,,,,,,,,,,,,,,,,,,,,,,,,,,,,,,,,,,,,,,,
A8UXPTKT,conferencePaper,2021,"Twardokus, Geoff; Ponicki, Jaime; Baker, Samantha; Carenzo, Peter; Rahbari, Hanif; Mishra, Sumita",Targeted discreditation attack against trust management in connected vehicles,ICC 2021 - IEEE International Conference on Communications,978-1-72817-122-7,,10.1109/ICC42927.2021.9500246,https://ieeexplore.ieee.org/document/9500246/,"Vehicle-to-vehicle (V2V) communication systems in the U.S. rely on IEEE 1609.2 security protocols for message authentication using digital signatures. A key requirement for trust management in such systems is the ability to detect misbehaving vehicles, e.g., when vehicles are repeatedly forging signatures. However, this creates a new attack surface where receivers cannot determine whether the causes of signature verification failures are indeed malicious attacks. In this paper, we present our novel, open-source, USRP-based testbed and utilize it to demonstrate how a stealthy reactive jammer can exploit this vulnerability. Our novel, targeted attack is highly efficient (even given the short validity period for vehicle pseudonyms) and difficult to detect. Our experimental results show that our attack can successfully discredit a victim in prominent misbehavior detection schemes with just two minutes of jamming. Finally, we discuss the capabilities and extensibility of our testbed as well as the challenges of potential attack mitigation techniques. 【摘要翻译】美国的车辆对车辆(V2V)通信系统依赖于 IEEE 1609.2安全协议来使用数字签名进行消息认证。在这类系统中，信任管理的一个关键要求是能够检测行为不端的车辆，例如，当车辆反复伪造签名时。但是，这将创建一个新的攻击面，其中接收方无法确定导致签名验证失败的原因是否确实是恶意攻击。在本文中，我们提出了一个新颖的、开源的、基于 USRP 的试验平台，并利用它来演示一个隐形的反应式干扰机如何能够利用这一漏洞。我们的新颖的，有针对性的攻击是非常有效的(即使给定的有效期很短的车辆假名)和难以检测。我们的实验结果表明，我们的攻击可以成功地在突出的不良行为检测方案的受害者只需两分钟的干扰。最后，我们讨论了我们的测试平台的功能和可扩展性，以及潜在的攻击缓解技术的挑战。",Jun-21,2023/12/18 11:00,2023/12/27 7:11,,,,,,,,针对关联车辆信任管理的认证攻击,IEEE international conference on communications,,,,IEEE / IEEE; Telus; Huawei; Ciena; Nokia; Samsung; Qualcomm; Cisco; Google Cloud,"345 E 47TH ST, NEW YORK, NY 10017 USA",en,2⭐,,,5 被引,,,🏷️ 📒、/Done、notion、车对车通信、反应式干扰、诋毁共计,"<h2 style=""color: #ff4757;"">📝 注释笔记 9A6W7AAQ>>>>>>></h2><blockquote><span style=""font-size: 15px;color: gray"">📍 2021-Twardokus-Targeted discreditation attack against trust management in connected vehicles</span></blockquote><blockquote><span class=""highlight"" style=""background-color: #ffd400"">A key requirement for trust management in such systems is the ability to detect misbehaving vehicles</span> (<a href=""zotero://open-pdf/library/items/9A6W7AAQ?page=1&annotation=EWF469PS"">p1</a>)</blockquote><blockquote><span class=""highlight"" style=""background-color: #ffd400"">we show that an intelligent attacker can induce repeated signature failures through strategic, stealthy, reactive jamming – a targeted discreditation attack – so that a legitimate vehicle whose messages are jammed may be improperly labeled as misbehaving by the VPKI</span><p>【译文】我们证明了一个聪明的攻击者可以通过策略性的、秘密的、反应性的干扰（一种有针对性的诋毁攻击）来诱导重复的签名失败，这样一个消息被干扰的合法车辆可能会被VPKI不恰当地标记为行为不端【译文】 (<a href=""zotero://open-pdf/library/items/9A6W7AAQ?page=1&annotation=AETIFTWC"">p1</a>)</blockquote><blockquote><span class=""highlight"" style=""background-color: #ff6666"">We accomplish this by developing a reactive, low-duty-cycle and hard-to-detect jamming attack that, despite error correction codes, causes a legitimate vehicle to be classiﬁed as misbehaving.</span><p>【译文】我们通过开发一种反应性、低占空比和难以检测的干扰攻击来实现这一点，尽管有纠错码，但这种攻击仍会导致合法车辆被归类为行为不端。【译文】 (<a href=""zotero://open-pdf/library/items/9A6W7AAQ?page=2&annotation=IDU84PFT"">p2</a>)</blockquote>; IEEE International Conference on Communications (ICC), ELECTR NETWORK, JUN 14-23, 2021; IEEE International Conference on Communications (ICC), ELECTR NETWORK, JUN 14-23, 2021",; E:\研究生\文献\zotero\storage\9A6W7AAQ\Twardokus 等 - 2021 - Targeted Discreditation Attack against Trust Management in Connected Vehicles.pdf,notion://www.notion.so/Targeted-discreditation-attack-against-trust-management-in-connected-vehicles-2f34a822ee304d1299f11097bceaff77,📒; /Done; notion; 车对车通信; 反应式干扰; 诋毁共计,,,,,,,,,,,,,,,,,,,,,,,,,,,,,,,,,,,,,,,,,,,,,,,
