Key,Item Type,Publication Year,Author,Title,Publication Title,ISBN,ISSN,DOI,Url,Abstract Note,Date,Date Added,Date Modified,Access Date,Pages,Num Pages,Issue,Volume,Number Of Volumes,Journal Abbreviation,Short Title,Series,Series Number,Series Text,Series Title,Publisher,Place,Language,Rights,Type,Archive,Archive Location,Library Catalog,Call Number,Extra,Notes,File Attachments,Link Attachments,Manual Tags,Automatic Tags,Editor,Series Editor,Translator,Contributor,Attorney Agent,Book Author,Cast Member,Commenter,Composer,Cosponsor,Counsel,Interviewer,Producer,Recipient,Reviewed Author,Scriptwriter,Words By,Guest,Number,Edition,Running Time,Scale,Medium,Artwork Size,Filing Date,Application Number,Assignee,Issuing Authority,Country,Meeting Name,Conference Name,Court,References,Reporter,Legal Status,Priority Numbers,Programming Language,Version,System,Code,Code Number,Section,Session,Committee,History,Legislative Body
IBVPRHR4,journalArticle,2022,"Sey, Collins; Lei, Hang; Qian, Weizhong; Li, Xiaoyu; Fiasam, Linda Delali; Kodjiku, Seth Larweh; Adjei-Mensah, Isaac; Agyemang, Isaac Osei",VBlock: A blockchain-based tamper-proofing data protection model for internet of vehicle networks,Sensors,,1424-8220,10.3390/s22208083,https://www.mdpi.com/1424-8220/22/20/8083,"The rapid advancement of the Internet of Vehicles (IoV) has led to a massive growth in data received from IoV networks. The cloud storage has been a timely service that provides a vast range of data storage for IoV networks. However, existing data storage and access models used to manage and protect data in IoV networks have proven to be insufficient. They are centralized and usually accompanied by a lack of trust, transparency, security, immutability, and provenance. In this paper, we propose VBlock, a blockchain-based system that addresses the issues of illegal modification of outsourced vehicular data for smart city management and improvement. We introduce a novel collusion-resistant model for outsourcing data to cloud storage that ensures the network remains tamper-proof, has good data provenance and auditing, and solves the centralized problems prone to the single point of failure. We introduced a key revocation mechanism to secure the network from malicious nodes. We formally define the system model of VBlock in the setting of a consortium blockchain. Our simulation results and security analysis show that the proposed model provides a strong security guarantee with high efficiency and is practicable in the IoV environment. 【摘要翻译】车辆互联网(IoV)的快速发展导致了从 IoV 网络接收数据的大规模增长。云存储一直是一项及时的服务，为 IoV 网络提供了广泛的数据存储。然而，用于管理和保护 IoV 网络中数据的现有数据存储和访问模型已被证明是不够的。它们是集中的，并且通常伴随着缺乏信任、透明度、安全性、不可变性和来源。在本文中，我们提出了 VBlock，一个基于区块链的系统，解决非法修改外包车辆数据的问题，用于智能城市管理和改进。我们引入了一种新的抗共谋模型来将数据外包到云存储，该模型能够保证网络不被篡改，具有良好的数据来源和审计能力，并且解决了容易发生单点故障的集中问题。我们引入了一种密钥撤销机制来保护网络免受恶意节点的攻击。在联盟区块链的设置下，形式化地定义了 VBlock 的系统模型。仿真结果和安全性分析表明，该模型提供了高效的安全保证，在 IoV 环境下是可行的。",Oct-22,2023/12/18 10:59,2023/12/24 7:40,,8083,,20,22,,Sens,基于区块链的车载网络互联网防篡改数据保护模型,,,,,,,en,2⭐,,,6 被引,3.9 (Q2),3,🏷️ /Done、📒、车联网、防篡改、密码学、区块链、数据外包、伪身份、无证书公钥加密、云存储、notion、📝 问题,"<h2 style=""color: purple;"">📑 翻译倒序>>>>>>></h2><blockquote>🔉 英  [无]<br>🔉 美  [无]<br>n.  英语字母表的第21个字母<p>👉 u</blockquote><blockquote>🔉 英  [无]<br>🔉 美  [无]<br>abbr.  primary biliary cirrhosis 原发性胆汁性肝硬化,peripheral bus computer 外围总线计算机,point of basal convergence 基线交汇点,pregnancy and birth complication(s) 怀孕和生产并发症<p>👉 pbc</blockquote>; <h2 style=""color: #ff4757;"">📝 注释笔记 PA9LL78M>>>>>>></h2><blockquote><span style=""font-size: 15px;color: gray"">📍 2022-Sey-VBlock: A blockchain-based tamper-proofing data protection model for internet of vehicle networks</span></blockquote><blockquote><span class=""highlight"" style=""background-color: #ffd400"">existing data storage and access models used to manage and protect data in IoV networks have proven to be insufﬁcient. They are centralized and usually accompanied by a lack of trust, transparency, security, immutability, and provenance.</span><p>【译文】用于管理和保护IoV网络中数据的现有数据存储和访问模型已被证明是不够的。它们是集中的，通常伴随着缺乏信任、透明度、安全性、不变性和出处。【译文】 (<a href=""zotero://open-pdf/library/items/PA9LL78M?page=1&annotation=YFJTQSBU"">p1</a>)<p>🏷️ #问题</blockquote><blockquote><span class=""highlight"" style=""background-color: #ffd400"">null</span><p>问题 (<a href=""zotero://open-pdf/library/items/PA9LL78M?page=1&annotation=2479XTCU"">p1</a>)</blockquote><blockquote><span class=""highlight"" style=""background-color: #ff6666"">We design a secure model called VBlock for outsourcing data to the cloud by IoV nodes which ensures tamper-prooﬁng, data provenance, and auditing.</span><p>【译文】我们设计了一个名为VBlock的安全模型，通过IoV节点将数据外包到云，确保防篡改、数据来源和审计。【译文】 (<a href=""zotero://open-pdf/library/items/PA9LL78M?page=3&annotation=QH9L5EQL"">p3</a>)</blockquote><blockquote><span class=""highlight"" style=""background-color: #ffd400"">The cloud server in our model only accepts the IoV data generated by the IoV node</span><p>【译文】我们模型中的云服务器只接受IoV节点生成的IoV数据【译文】 (<a href=""zotero://open-pdf/library/items/PA9LL78M?page=3&annotation=9862AVCV"">p3</a>)</blockquote><blockquote><span class=""highlight"" style=""background-color: #ff6666"">certiﬁcate/key revocation mechanism</span><p>【译文】证书/密钥撤销机制【译文】 (<a href=""zotero://open-pdf/library/items/PA9LL78M?page=3&annotation=2IGKFHKK"">p3</a>)</blockquote><blockquote><span class=""highlight"" style=""background-color: #ffd400"">null</span><p>证书/密钥撤销机制 (<a href=""zotero://open-pdf/library/items/PA9LL78M?page=3&annotation=QUNI2VTM"">p3</a>)</blockquote><blockquote><span class=""highlight"" style=""background-color: #ffd400"">Communication Design</span><p>【译文】通信设计【译文】 (<a href=""zotero://open-pdf/library/items/PA9LL78M?page=10&annotation=FVJY8GY7"">p10</a>)</blockquote><blockquote><span class=""highlight"" style=""background-color: #ffd400"">We leverage an efﬁcient certiﬁcateless public key cryptography scheme</span><p>【译文】我们利用了一种高效的无证书公钥加密方案【译文】 (<a href=""zotero://open-pdf/library/items/PA9LL78M?page=12&annotation=P9WWAPSD"">p12</a>)</blockquote><blockquote><span class=""highlight"" style=""background-color: #ffd400"">We anonymize the real identity of nodes with a pseudo-identity</span><p>【译文】我们用伪身份匿名化节点的真实身份【译文】 (<a href=""zotero://open-pdf/library/items/PA9LL78M?page=12&annotation=Y4GBK92Y"">p12</a>)</blockquote><blockquote><span class=""highlight"" style=""background-color: #ffd400"">success rate, transaction latency, and transaction throughput</span><p>【译文】成功率、事务延迟和事务吞吐量【译文】 (<a href=""zotero://open-pdf/library/items/PA9LL78M?page=16&annotation=ZHANHZGI"">p16</a>)</blockquote><blockquote><span class=""highlight"" style=""background-color: #ffd400"">the Pairing Base Cryptography (PBC) Library</span><p>【译文】配对基础密码学（PBC）库【译文】 (<a href=""zotero://open-pdf/library/items/PA9LL78M?page=16&annotation=LRKCX8UN"">p16</a>)</blockquote><blockquote><span class=""highlight"" style=""background-color: #ffd400"">a secure data outsourcing model</span><p>【译文】一种安全的数据外包模型【译文】 (<a href=""zotero://open-pdf/library/items/PA9LL78M?page=20&annotation=QEXNIKMT"">p20</a>)</blockquote><blockquote><span class=""highlight"" style=""background-color: #ffd400"">We introduced a key revocation mechanism to further secure the IoV network from malicious or compromised nodes.</span><p>【译文】我们引入了密钥撤销机制来进一步保护IoV网络免受恶意或受损节点的攻击。【译文】 (<a href=""zotero://open-pdf/library/items/PA9LL78M?page=20&annotation=EJJPR37X"">p20</a>)</blockquote>",; E:\研究生\文献\zotero\storage\PA9LL78M\Sey 等 - 2022 - VBlock A blockchain-based tamper-proofing data protection model for internet of vehicle networks.pdf,notion://www.notion.so/VBlock-A-blockchain-based-tamper-proofing-data-protection-model-for-internet-of-vehicle-networks-2bfc50e6f1274ca8abd1ae8fa11fbe6d,📒; /Done; notion; 区块链; 车联网; 防篡改; 云存储; 无证书公钥加密; 伪身份; 密码学; 数据外包,,,,,,,,,,,,,,,,,,,,,,,,,,,,,,,,,,,,,,,,,,,,,,,
RHETC4CZ,conferencePaper,2021,"Liu, Xiangguo; Luo, Baiting; Abdo, Ahmed; Abu-Ghazaleh, Nael; Zhu, Qi",Securing connected vehicle applications with an efficient dual cyber- physical blockchain framework,2021 IEEE Intelligent Vehicles Symposium (IV),978-1-72815-394-0,,10.1109/IV48863.2021.9575869,https://ieeexplore.ieee.org/document/9575869/,"While connected vehicle (CV) applications have the potential to revolutionize traditional transportation system, cyber and physical attacks on them may lead to disastrous consequences. In this work, we propose an efficient dual cyber-physical blockchain framework to build trust and secure communication for CV applications. Our approach incorporates blockchain technology and physical sensing capabilities of vehicles to quickly react to attacks in a large-scale vehicular network, with low resource overhead. We explore the application of our framework to three CV applications, i.e., highway merging, intelligent intersection management, and traffic network with route choices. Simulation results demonstrate the effectiveness of our blockchain-based framework in defending against spoofing attacks, bad mouthing attacks, and Sybil and voting attacks. We also provide analysis to show the timing and resource efficiency of our framework. 【摘要翻译】虽然连接车辆(CV)应用有可能彻底改变传统的交通系统，网络和物理攻击可能会导致灾难性的后果。在这项工作中，我们提出了一个有效的双网络-物理区块链框架，以建立信任和安全通信的简历应用。我们的方法结合了区块链技术和车辆的物理感应能力，以快速反应的攻击，在大规模的车辆网络，以低资源开销。我们探讨了我们的框架在三个 CV 应用中的应用，即高速公路合并、智能交叉口管理和带有路径选择的交通网络。仿真结果表明了我们的区块链框架在防御欺骗性攻击、恶意口供攻击、 Sybil 攻击和投票攻击方面的有效性。我们还提供了分析，以显示我们的框架的时机和资源效率。",2021/7/11,2023/12/18 10:59,2023/12/24 10:18,,393-400,,,,,,通过有效的双网络-物理区块链框架保护连接的车辆应用程序,IEEE intelligent vehicles symposium,,,,IEEE / IEEE; Toyota; TierIV; Denso; AISIN Corp; J Quad Dynam; Totota Tech Dev Corp; SenseTime; IDTechEx; Qualcomm; Toshiba; Sony; Natl Inst Informat & Commun Technol; Tateisi Sci & Technol Fdn; Telecommunicat Advancement Fdn; KDDI Fdn; Kajima Fdn; Kayamori Fdn Informat Sci Advancement; Daiko Fdn,"345 E 47TH ST, NEW YORK, NY 10017 USA",en,3⭐,,,6 被引,,,🏷️ /Done、📒、区块链、网联汽车、信息共享、验证信息真伪、notion、📝 创新,"<h2 style=""color: #ff4757;"">📝 注释笔记 INDHLUAB>>>>>>></h2><blockquote><span style=""font-size: 15px;color: gray"">📍 2021-Liu-Securing connected vehicle applications with an efficient dual cyber- physical blockchain framework</span></blockquote><blockquote><span class=""highlight"" style=""background-color: #ff6666"">dual cyber-physical blockchain framework to build trust and secure communication for CV applications</span><p>【译文】为CV应用建立信任和安全通信的双网络物理区块链框架【译文】 (<a href=""zotero://open-pdf/library/items/INDHLUAB?page=1&annotation=AH6M5HNJ"">p1</a>)</blockquote><blockquote><span class=""highlight"" style=""background-color: #ff6666"">incorporates blockchain technology and physical sensing capabilities of vehicles to quickly react to attacks in a large-scale vehicular network, with low resource overhead.</span><p>【译文】整合了区块链技术和车辆的物理传感能力，以低资源开销快速应对大规模车辆网络中的攻击。【译文】 (<a href=""zotero://open-pdf/library/items/INDHLUAB?page=1&annotation=XB93BCB5"">p1</a>)</blockquote><blockquote><span class=""image#ffd400""><img src=""https://raw.githubusercontent.com/huangyuanhao/pictureBed/main/20231224154720.png"" width=""500px"" /></span><br>图1。概述我们提出的双重信息物理区块链框架。 (<a href=""zotero://open-pdf/library/items/INDHLUAB?page=2&annotation=ADRPV556"">p2</a>)</blockquote><blockquote><span class=""highlight"" style=""background-color: #ffd400"">null</span><p>重要 (<a href=""zotero://open-pdf/library/items/INDHLUAB?page=2&annotation=NDTJFRR4"">p2</a>)</blockquote><blockquote><span class=""highlight"" style=""background-color: #ff6666"">We develop a novel dual blockchain framework thatleverages cybersecurity techniques, physical sensing capabilities of vehicles, and their travel histories to build trust and secure communication in a large-scale vehicular network, in which every vehicle can get updates timely with low resource overhead.</span><p>【译文】我们开发了一种新颖的双区块链框架，该框架利用网络安全技术、车辆的物理传感能力及其行驶历史，在大规模车辆网络中建立信任和安全通信，其中每辆车都可以以较低的资源开销及时获得更新。【译文】 (<a href=""zotero://open-pdf/library/items/INDHLUAB?page=2&annotation=2SBJPGCZ"">p2</a>)<p>🏷️ #创新</blockquote><blockquote><span class=""highlight"" style=""background-color: #ffd400"">against a few prevalent attacks</span><p>【译文】对抗一些流行的攻击【译文】 (<a href=""zotero://open-pdf/library/items/INDHLUAB?page=2&annotation=3DG925EP"">p2</a>)</blockquote>; 32nd IEEE Intelligent Vehicles Symposium (IV), ELECTR NETWORK, JUL 11-17, 2021; 32nd IEEE Intelligent Vehicles Symposium (IV), ELECTR NETWORK, JUL 11-17, 2021",E:\研究生\文献\zotero\storage\INDHLUAB\Liu 等 - 2021 - Securing connected vehicle applications with an efficient dual cyber-physical blockchain framework.pdf; ,notion://www.notion.so/Securing-connected-vehicle-applications-with-an-efficient-dual-cyber-physical-blockchain-framework-4d22eaf693464588b0b467430b117ad1,📒; /Done; notion; 区块链; 网联汽车; 验证信息真伪; 信息共享,,,,,,,,,,,,,,,,,,,,,,,,,,,,,,,,,,,,,,,,,,,,,,,
A2H4JNHN,conferencePaper,2022,"Sedar, Roshan; Kalalas, Charalampos; Alonso-Zarate, Jesus; Vazquez-Gallego, Francisco",Multi-domain denial-of-service attacks in internet-of-vehicles: Vulnerability insights and detection performance,2022 IEEE 8th International Conference on Network Softwarization (NetSoft),978-1-66540-694-9,,10.1109/NetSoft54395.2022.9844055,https://ieeexplore.ieee.org/document/9844055/,"The transformative Internet-of-Vehicles (IoV) paradigm comes inadvertently with challenges which involve security vulnerabilities and privacy breaches. In this context, denial-of-service (DoS) attacks may perniciously affect the normal operation of IoV systems by causing extensive periods of network unavailability where legitimate vehicles are prevented from accessing vehicular services. In this paper, we offer an in-depth vulnerability assessment of 5G-enabled IoV systems when DoS attack variants are launched at multiple network domains. We further evaluate the resilience of an IoV-tailored authentication mechanism against DoS attacks under various configurations. A data-driven detection scheme is also proposed to address DoS variants in the radio access network, which take the form of false data injection attacks on the exchanged vehicular information. Our performance assessment with the aid of an open-source dataset reveals that the proposed scheme is able to accurately detect DoS traffic originated from malicious vehicles. 【摘要翻译】变革性的车辆互联网(IoV)范式无意中带来了涉及安全漏洞和隐私破坏的挑战。在这种情况下，拒绝服务(DoS)攻击可能会对 IoV 系统的正常运行造成有害影响，因为它会导致合法车辆无法访问车辆服务的长时间网络不可用。在本文中，我们提供了一个深入的脆弱性评估5G 支持的 IoV 系统时，DoS 攻击变种发射在多个网络域。我们进一步评估了 IoV 定制的认证机制在不同配置下对 DoS 攻击的弹性。提出了一种基于数据驱动的检测方案来解决无线接入网中的拒绝服务攻击(DoS)问题，该方案采用对交换的车辆信息进行虚假数据注入攻击的形式。我们借助于一个开源数据集进行的性能评估表明，该方案能够准确地检测来自恶意车辆的 DoS 流量。",2022/6/27,2023/12/18 11:00,2023/12/26 7:23,,438-443,,,,,,车辆互联网中的多域拒绝服务攻击: 漏洞洞察和检测性能,,,,,IEEE / IEEE; Intel; Huawei; Eolo; Italtel; Tiesse,"345 E 47TH ST, NEW YORK, NY 10017 USA",en,2⭐,,,1 被引,,,🏷️ /Done、📒、拒绝服务攻击、身份验证、notion、📝 例句,"<h2 style=""color: purple;"">📑 翻译倒序>>>>>>></h2><blockquote>🔉 英  [无]<br>🔉 美  [无]<br>n.  英语字母表的第5个字母,C大调音阶中的第三音<p>👉 e</blockquote>; <h2 style=""color: purple;"">📙 生词>>>>>>></h2><p><a href=""zotero://open-pdf/library/items/6ZL6TYHM?page=1&annotation=EYET3TVV"">radio access network (RAN)</a>: <code> 无线接入网</code><p>; <h2 style=""color: #ff4757;"">📝 注释笔记 6ZL6TYHM>>>>>>></h2><blockquote><span style=""font-size: 15px;color: gray"">📍 2022-Sedar-Multi-domain denial-of-service attacks in internet-of-vehicles: Vulnerability insights and detection performance</span></blockquote><blockquote><span class=""highlight"" style=""background-color: #ffd400"">denial-of-service (DoS) attacks may perniciously affect the normal operation of IoV systems</span><p>【译文】拒绝服务（DoS）攻击会严重影响IoV系统的正常运行【译文】 (<a href=""zotero://open-pdf/library/items/6ZL6TYHM?page=1&annotation=TLDC9NDH"">p1</a>)</blockquote><blockquote><span class=""highlight"" style=""background-color: #ffd400"">Vehicle authentication based on cuckoo filter</span><p>【译文】基于cuckoo滤波器的车辆认证【译文】 (<a href=""zotero://open-pdf/library/items/6ZL6TYHM?page=2&annotation=IQ5W4ASX"">p2</a>)</blockquote><blockquote><span class=""highlight"" style=""background-color: #ffd400"">Insider attacks are often difficult to detect and contain, particularly when attackers behave intelligently while conforming to normal system behavior.</span><p>【译文】内部攻击通常很难检测和遏制，尤其是当攻击者在遵循正常系统行为的同时表现智能时。【译文】 (<a href=""zotero://open-pdf/library/items/6ZL6TYHM?page=3&annotation=EHKBBDV3"">p3</a>)</blockquote><blockquote><span class=""highlight"" style=""background-color: #ffd400"">null</span><p>外部攻击和内部攻击 (<a href=""zotero://open-pdf/library/items/6ZL6TYHM?page=3&annotation=KERPUSRF"">p3</a>)</blockquote>; 8th IEEE International Conference on Network Softwarization (NetSoft) - Network Softwarization Coming of Age - New Challenges and Opportunities, Politecnico Milano, Dipartimento Elettronica, Informazione &amp; Bioingegneria, Milan, ITALY, JUN 27-JUL 01, 2022; 8th IEEE International Conference on Network Softwarization (NetSoft) - Network Softwarization Coming of Age - New Challenges and Opportunities, Politecnico Milano, Dipartimento Elettronica, Informazione &amp; Bioingegneria, Milan, ITALY, JUN 27-JUL 01, 2022",; E:\研究生\文献\zotero\storage\6ZL6TYHM\Sedar 等 - 2022 - Multi-domain denial-of-service attacks in internet-of-vehicles Vulnerability insights and detection.pdf,notion://www.notion.so/Multi-domain-denial-of-service-attacks-in-internet-of-vehicles-Vulnerability-insights-and-detection-73add6cc4f2a41aba40c47b0c72baae8,📒; /Done; notion; 身份验证; 拒绝服务攻击,,,,,,,,,,,,,,,,,,,,,,,,,,,,,,,,,,,,,,,,,,,,,,,
